{
  "$schema": "../../schemas/questionnaire.schema.json",
  "version": "2026-05-30-candidate-v2",
  "startQuestionId": "target",
  "resultNode": "result",
  "questions": [
    {
      "id": "target",
      "title": "送给谁",
      "type": "single",
      "defaultNext": "gender",
      "options": [
        { "value": "partner", "label": "恋人", "size": "xl" },
        { "value": "parents", "label": "爸妈", "size": "xl" },
        { "value": "bestie", "label": "闺蜜", "size": "xl" }
      ]
    },
    {
      "id": "gender",
      "title": "TA 是",
      "type": "single",
      "defaultNext": "scene",
      "options": [
        { "value": "female", "label": "女生", "size": "xl" },
        { "value": "male", "label": "男生", "size": "xl" }
      ]
    },
    {
      "id": "scene",
      "title": "什么场合",
      "type": "single",
      "defaultNext": "occupation",
      "options": [
        { "value": "birthday", "label": "生日", "size": "xl" },
        { "value": "anniversary", "label": "纪念日", "size": "lg" },
        { "value": "festival", "label": "节日", "size": "lg" },
        { "value": "apology", "label": "道歉/和好", "size": "md" },
        { "value": "daily", "label": "日常关心", "size": "md" }
      ]
    },
    {
      "id": "occupation",
      "title": "TA 大概做什么的",
      "type": "single",
      "defaultNext": "recipientStyle",
      "options": [
        { "value": "office", "label": "坐办公室的", "size": "lg" },
        { "value": "tech", "label": "程序员/互联网", "size": "lg" },
        { "value": "creative", "label": "设计/创意/媒体", "size": "md" },
        { "value": "medical_education", "label": "医生/老师", "size": "md" },
        { "value": "student", "label": "学生", "size": "lg" },
        { "value": "freelance", "label": "自由职业/创业", "size": "md" },
        { "value": "homemaker", "label": "在家/退休", "size": "sm" }
      ]
    },
    {
      "id": "recipientStyle",
      "title": "TA 平时偏哪种",
      "type": "single",
      "defaultNext": "budget",
      "options": [
        { "value": "practical", "label": "实用派，喜欢好用的东西", "size": "xl" },
        { "value": "aesthetic", "label": "颜值控，喜欢好看的", "size": "lg" },
        { "value": "experiential", "label": "体验派，喜欢新鲜感", "size": "lg" },
        { "value": "quality", "label": "品质党，在意质感和品牌", "size": "md" }
      ]
    },
    {
      "id": "budget",
      "title": "大概想花多少",
      "type": "single",
      "defaultNext": "result",
      "options": [
        { "value": "under_200", "label": "200 以内", "size": "md" },
        { "value": "200_500", "label": "200-500", "size": "xl" },
        { "value": "500_1000", "label": "500-1000", "size": "lg" },
        { "value": "1000_2000", "label": "1000-2000", "size": "lg" },
        { "value": "2000_plus", "label": "2000 以上", "size": "sm" }
      ]
    }
  ]
}
